{"dataset":{"id":"dsh-memory-lexical","referenceCommit":"2dc101db4d368866051af62d18897d6889511400","version":"1.0.0"},"delta":{"mrrAt10":0.729167,"recallAt10":0.75,"recallAt5":0.75},"embeddingSpace":{"dimensions":256,"id":"dsh-memory/hash-token-char-v1/256/l2"},"modes":{"cjkBigram":{"buckets":[{"bucket":"continuous_cjk","mrrAt10":0.916667,"queryCount":6,"recallAt10":1,"recallAt5":1},{"bucket":"mixed_language","mrrAt10":1,"queryCount":6,"recallAt10":1,"recallAt5":1},{"bucket":"punctuation_boundary","mrrAt10":1,"queryCount":6,"recallAt10":1,"recallAt5":1},{"bucket":"short_term","mrrAt10":1,"queryCount":6,"recallAt10":1,"recallAt5":1}],"cases":[{"bucket":"continuous_cjk","firstRelevantRank":1,"forbiddenHits":[],"forbiddenIds":[],"id":"q0101","recallAt10":1,"recallAt5":1,"reciprocalRank":1,"relevantIds":["r7dea70aa0b5b"],"returnedIds":["r7dea70aa0b5b","r946d80851b0d","r1048805ddadc","r8ad9304f9305","r30488d2d02d0","rffaefe5f27bc","r67352f0923bc","rd21e42e75e42","re99c038e2724","r0d0dfe4b0e21"],"split":"baseline"},{"bucket":"mixed_language","firstRelevantRank":1,"forbiddenHits":[],"forbiddenIds":[],"id":"q0102","recallAt10":1,"recallAt5":1,"reciprocalRank":1,"relevantIds":["r22413640d2de"],"returnedIds":["r22413640d2de","rc939d4acd354","r56ff1f174c47","read69e4a37cd","r7dea70aa0b5b","r8d9ff9130f13"],"split":"baseline"},{"bucket":"punctuation_boundary","firstRelevantRank":1,"forbiddenHits":[],"forbiddenIds":[],"id":"q0103","recallAt10":1,"recallAt5":1,"reciprocalRank":1,"relevantIds":["rc939d4acd354"],"returnedIds":["rc939d4acd354","r88077c37a959","r5920e7756249","rcdc0b985684d","r592279951a52","rb5790a228c31","rf6e127459822","rfd9c95202861","r03e4fc701883","r59134cd3c2ed"],"split":"baseline"},{"bucket":"short_term","firstRelevantRank":1,"forbiddenHits":[],"forbiddenIds":[],"id":"q0104","recallAt10":1,"recallAt5":1,"reciprocalRank":1,"relevantIds":["r69f5c4a127d4"],"returnedIds":["r69f5c4a127d4","r5920e7756249","r5ae7dadbd2cd","ra68a01d48a4f","rcf9975fde731","rf3d0de67d236","r04253a85541f","rac6cf880693b","r9b69596f2b13","r2169d78da5ec"],"split":"baseline"},{"bucket":"continuous_cjk","firstRelevantRank":1,"forbiddenHits":[],"forbiddenIds":[],"id":"q0201","recallAt10":1,"recallAt5":1,"reciprocalRank":1,"relevantIds":["r539be15d088f"],"returnedIds":["r539be15d088f","r52ba446f7a16","ra905bad85e92","r723befcb6fa2","re9d65dbb7afc","r8e7d2873d69b","r30b19ad71da5","r61f71f4c2cbd","re9a946989332","re181ef1f9da3"],"split":"baseline"},{"bucket":"mixed_language","firstRelevantRank":1,"forbiddenHits":[],"forbiddenIds":[],"id":"q0202","recallAt10":1,"recallAt5":1,"reciprocalRank":1,"relevantIds":["r48c3b6a8dcfa"],"returnedIds":["r48c3b6a8dcfa","r5065e62e5ccc","re2465054d97c","r9c85674215f8","rb7993c7cd466","r2a33673cd9f1","rbc5f49885139","rb1d74d53b9eb","r4354de2287e3","r453abed4ac62"],"split":"baseline"},{"bucket":"punctuation_boundary","firstRelevantRank":1,"forbiddenHits":[],"forbiddenIds":[],"id":"q0203","recallAt10":1,"recallAt5":1,"reciprocalRank":1,"relevantIds":["r18b4b0432244"],"returnedIds":["r18b4b0432244","r8d1110b787c9","r07ebf8581a28","r4f938db9a29f","r5065e62e5ccc","re2465054d97c","r9c85674215f8","rb7993c7cd466","r2a33673cd9f1","rbc5f49885139"],"split":"baseline"},{"bucket":"short_term","firstRelevantRank":1,"forbiddenHits":[],"forbiddenIds":[],"id":"q0204","recallAt10":1,"recallAt5":1,"reciprocalRank":1,"relevantIds":["rf290df5f5446"],"returnedIds":["rf290df5f5446","rda4a9b369e7e","r47c10b65f6f5","re4f6804874c7","raa3889981c6c","r9c76cf78c165","r3302c1df0ec2","rb214c84de0a0","rc073eefe78e2","r4c76170b2f01"],"split":"baseline"},{"bucket":"continuous_cjk","firstRelevantRank":2,"forbiddenHits":[],"forbiddenIds":[],"id":"q0301","recallAt10":1,"recallAt5":1,"reciprocalRank":0.5,"relevantIds":["rb2076776e931"],"returnedIds":["r6b2f45bc5ce4","rb2076776e931","rc6770de8f3b2","rd8d7c28f99aa","r297832d36c3f","r2502fb6bab11","r2b9122e35715","r2a36730914eb","r35ca60793d2f","rdd821a06cd33"],"split":"baseline"},{"bucket":"mixed_language","firstRelevantRank":1,"forbiddenHits":[],"forbiddenIds":[],"id":"q0302","recallAt10":1,"recallAt5":1,"reciprocalRank":1,"relevantIds":["rf6e427fe22d5"],"returnedIds":["rf6e427fe22d5","r2b9122e35715","r55fc39bdd59e","r32c6de676d5b","r38bd30962aac","rdbc2e9820d16","r030b1e6f3d72","r9c8e232f5cfd","r6b2f45bc5ce4"],"split":"baseline"},{"bucket":"punctuation_boundary","firstRelevantRank":1,"forbiddenHits":[],"forbiddenIds":[],"id":"q0303","recallAt10":1,"recallAt5":1,"reciprocalRank":1,"relevantIds":["rfc01ae9e5b58"],"returnedIds":["rfc01ae9e5b58","r55fc39bdd59e","r73f557a3ba6f","r29bd7586f348","r4b01c20c5b50","r32c6de676d5b","r86973e4e689a","r0df13df6093d","r37bf5d0c22cb","r092c54e5816c"],"split":"baseline"},{"bucket":"short_term","firstRelevantRank":1,"forbiddenHits":[],"forbiddenIds":[],"id":"q0304","recallAt10":1,"recallAt5":1,"reciprocalRank":1,"relevantIds":["r6b2f45bc5ce4"],"returnedIds":["r6b2f45bc5ce4","rb2076776e931","r20a9a3768f5e","rdd43b8923d53","re877e53ace43","rdba2fa1a18dd","r61732f146148","ra30603983b11","r8b75a301c259","r06e022ca00b7"],"split":"baseline"},{"bucket":"continuous_cjk","firstRelevantRank":1,"forbiddenHits":[],"forbiddenIds":[],"id":"q0401","recallAt10":1,"recallAt5":1,"reciprocalRank":1,"relevantIds":["r10eff8e19f91"],"returnedIds":["r10eff8e19f91","r0be809269338","r18955b861426","r77fcd2761862","rfd82eca3916e","rd1a925d3622c","ra4f586bf6958","rb4aaacdf625b","r080065340ef7","r13db320ec9f5"],"split":"holdout"},{"bucket":"mixed_language","firstRelevantRank":1,"forbiddenHits":[],"forbiddenIds":[],"id":"q0402","recallAt10":1,"recallAt5":1,"reciprocalRank":1,"relevantIds":["r7698a96f6148"],"returnedIds":["r7698a96f6148","r13db320ec9f5","r39030a383ea9","rbb5f81498b95","rb3f5c05c16a5","r7d87743fc828","r61db2da565c8","r41fb4e35f0c9","rc57dccd56538","r659baf6a9fb8"],"split":"holdout"},{"bucket":"punctuation_boundary","firstRelevantRank":1,"forbiddenHits":[],"forbiddenIds":[],"id":"q0403","recallAt10":1,"recallAt5":1,"reciprocalRank":1,"relevantIds":["r08a6455168c6"],"returnedIds":["r08a6455168c6","r4dd430ee1298","r741df8f5efe6","ra783950e9fca","rdfc6983decfe","r06fb22c32084","r39030a383ea9","rbb5f81498b95","rb3f5c05c16a5","r7d87743fc828"],"split":"holdout"},{"bucket":"short_term","firstRelevantRank":1,"forbiddenHits":[],"forbiddenIds":[],"id":"q0404","recallAt10":1,"recallAt5":1,"reciprocalRank":1,"relevantIds":["r0be809269338"],"returnedIds":["r0be809269338","r10eff8e19f91","r7f92e5ed74ae","r1aa48a7c27cb","r19c5a2aa2a80","r7c14400d3447","r741bd5f6a627","r659baf6a9fb8","redd28c44c4c7","r431b559bb800"],"split":"holdout"},{"bucket":"continuous_cjk","firstRelevantRank":1,"forbiddenHits":[],"forbiddenIds":[],"id":"q0501","recallAt10":1,"recallAt5":1,"reciprocalRank":1,"relevantIds":["r5721e89c9d20"],"returnedIds":["r5721e89c9d20","rf246191c0d81","rea0377175867","r6cad22273cdd","r2ee3061724e1","r2ca462bceba9","r22689be987fd","re7a5a3dd68ff","r6d5f139447ed","rba75c1f85bc0"],"split":"holdout"},{"bucket":"mixed_language","firstRelevantRank":1,"forbiddenHits":[],"forbiddenIds":[],"id":"q0502","recallAt10":1,"recallAt5":1,"reciprocalRank":1,"relevantIds":["r0623054cf0cd"],"returnedIds":["r0623054cf0cd","r28c72828f72e","ra1ca0fdeb0b8","r2302acd14fba","r1a8832e0b38c","r20b2b2fe6ac4","rbc6cdbcd3e32","r3cc06c1ea77d","r0ba8a25c8d80"],"split":"holdout"},{"bucket":"punctuation_boundary","firstRelevantRank":1,"forbiddenHits":[],"forbiddenIds":[],"id":"q0503","recallAt10":1,"recallAt5":1,"reciprocalRank":1,"relevantIds":["rd1570d1f96c7"],"returnedIds":["rd1570d1f96c7","r28c72828f72e","ra1ca0fdeb0b8","rf60e2d5019e3","r2d76735b01af","r56a37b60d871","r9b0c7325c075","r2302acd14fba","r1a8832e0b38c","r20b2b2fe6ac4"],"split":"holdout"},{"bucket":"short_term","firstRelevantRank":1,"forbiddenHits":[],"forbiddenIds":[],"id":"q0504","recallAt10":1,"recallAt5":1,"reciprocalRank":1,"relevantIds":["r1a7a7979f082"],"returnedIds":["r1a7a7979f082","r7e3344914b32","rfcecbb312fac","r3dd7da3bd6a6","r5dcb929780c3","r530636b6ea47","rfc08d3177295","rf5b88fa51f3e","re02754614f0d","r26d0f066942d"],"split":"holdout"},{"bucket":"continuous_cjk","firstRelevantRank":1,"forbiddenHits":[],"forbiddenIds":[],"id":"q0601","recallAt10":1,"recallAt5":1,"reciprocalRank":1,"relevantIds":["re8b59c1dd92d"],"returnedIds":["re8b59c1dd92d","r70c337e4e0d8","rf1546e1ebf52","r4b052ee5b6a4","r4c48a4d5b19f","r39368e8b8304","rec1145a64271","r3b854ea2c245","r69b2e1c70031","r11b2055865fb"],"split":"baseline"},{"bucket":"mixed_language","firstRelevantRank":1,"forbiddenHits":[],"forbiddenIds":[],"id":"q0602","recallAt10":1,"recallAt5":1,"reciprocalRank":1,"relevantIds":["r55ee6cb85bd0"],"returnedIds":["r55ee6cb85bd0","r7ca2382789f5","rbdbcdd367bb7","r4ee6454195ab"],"split":"baseline"},{"bucket":"punctuation_boundary","firstRelevantRank":1,"forbiddenHits":[],"forbiddenIds":[],"id":"q0603","recallAt10":1,"recallAt5":1,"reciprocalRank":1,"relevantIds":["rd7ac90bc5fb2"],"returnedIds":["rd7ac90bc5fb2","rcb73fcafe45f","rfc5780a4ffdc","r691841e6d27d","r551cfdfbb9ad","r9e90cad91485","r1e36b0a6bc7a","r7ca2382789f5","r36e5c2e78d12","r84f0f3f0361e"],"split":"baseline"},{"bucket":"short_term","firstRelevantRank":1,"forbiddenHits":[],"forbiddenIds":[],"id":"q0604","recallAt10":1,"recallAt5":1,"reciprocalRank":1,"relevantIds":["r8fdb7fdfc2b7"],"returnedIds":["r8fdb7fdfc2b7","r69e2567e3c47","rfb23d725f329","r4f9ecc98c56b","r48c355477edc","rfa997f752e24","r33a45c71ade5","r286517b812de","r2b05ad021023","r56891ffd8522"],"split":"baseline"},{"bucket":"filter","firstRelevantRank":null,"forbiddenHits":[],"forbiddenIds":["ra06dc82c53df"],"id":"q9001","recallAt10":null,"recallAt5":null,"reciprocalRank":null,"relevantIds":[],"returnedIds":["r6b82950ed4ee"],"split":"filter"},{"bucket":"filter","firstRelevantRank":null,"forbiddenHits":[],"forbiddenIds":["r33b9bd1e28f4"],"id":"q9002","recallAt10":null,"recallAt5":null,"reciprocalRank":null,"relevantIds":[],"returnedIds":["r6b82950ed4ee"],"split":"filter"},{"bucket":"filter","firstRelevantRank":null,"forbiddenHits":[],"forbid